{"round": 0, "timestamp": "2026-06-29T09:42:16.240639+00:00", "asset": "python\\configs\\active.yaml", "asset_kind": "config", "change_description": "config.delta_init: 0.72 -> 0.684", "baseline_score_before": 0.947339, "new_score": 0.94245, "decision": "reverted", "score_delta": -0.004889, "submetrics": {"test_acc_clean": 0.940344, "test_acc_perturbed": 0.909112, "inference_latency_ms": 46.5, "energy_rel_v4": 0.19813, "alpha": 1.253308, "delta": 0.734, "alpha_delta_ratio": 1.707505, "eta_tern": 1.0, "zeta_Z3": 1.0, "V": 0.89418, "N": 0.943155, "S": 0.056845, "Df": 9.015142, "GS": 129.417986, "RT": 2.61803, "goldenscore": 0.953481, "spec_quality": 0.833083, "prompt_quality": 1.0}, "report_path": "python\\runs\\auto_research\\20260629T094216235006Z\\report.json", "baseline_report_path": "python\\runs\\auto_research\\20260629T094216216839Z\\report.json", "ollama_suggestion": null, "ollama_suggestion_raw": null, "ollama_model_used": null, "llm_context_snapshot": {"current_score": 0.947339, "target_score": 0.92, "epsilon": 0.0005, "plateau_limit": 3, "asset_kind": "config", "model": "llama3:latest", "models": ["qwen25-base:latest", "qwen35-mmss:latest", "qwen-coder-3b-cpu:latest"]}, "summary_text": "asset=config change=config.delta_init: 0.72 -> 0.684 decision=reverted score=0.942450 V=0.89418 S=0.056845 clean=0.940344 energy=0.19813"}
{"round": 0, "timestamp": "2026-06-29T09:51:22.473796+00:00", "asset": "D:\\project\\python\\configs\\active.yaml", "asset_kind": "config", "change_description": "config.delta_init: 0.72 -> 0.684", "baseline_score_before": 0.947339, "new_score": 0.94245, "decision": "reverted", "score_delta": -0.004889, "submetrics": {"test_acc_clean": 0.940344, "test_acc_perturbed": 0.909112, "inference_latency_ms": 46.5, "energy_rel_v4": 0.19813, "alpha": 1.253308, "delta": 0.734, "alpha_delta_ratio": 1.707505, "eta_tern": 1.0, "zeta_Z3": 1.0, "V": 0.89418, "N": 0.943155, "S": 0.056845, "Df": 9.015142, "GS": 129.417986, "RT": 2.61803, "goldenscore": 0.953481, "spec_quality": 0.833083, "prompt_quality": 1.0}, "report_path": "python\\runs\\auto_research\\20260629T095122469218Z\\report.json", "baseline_report_path": "python\\runs\\auto_research\\20260629T095122425542Z\\report.json", "ollama_suggestion": null, "ollama_suggestion_raw": null, "ollama_model_used": null, "llm_context_snapshot": {"current_score": 0.947339, "target_score": 0.92, "epsilon": 0.0005, "plateau_limit": 3, "asset_kind": "config", "model": "qwen2.5-coder:3b", "models": ["qwen-coder-3b-cpu:latest", "qwen2.5-coder:3b", "llama3"]}, "summary_text": "asset=config change=config.delta_init: 0.72 -> 0.684 decision=reverted score=0.942450 V=0.89418 S=0.056845 clean=0.940344 energy=0.19813"}
{"round": 0, "timestamp": "2026-06-29T09:54:45.790475+00:00", "asset": "D:\\project\\python\\configs\\active.yaml", "asset_kind": "config", "change_description": "config.delta_init: 0.72 -> 0.684", "baseline_score_before": 0.947339, "new_score": 0.94245, "decision": "reverted", "score_delta": -0.004889, "submetrics": {"test_acc_clean": 0.940344, "test_acc_perturbed": 0.909112, "inference_latency_ms": 46.5, "energy_rel_v4": 0.19813, "alpha": 1.253308, "delta": 0.734, "alpha_delta_ratio": 1.707505, "eta_tern": 1.0, "zeta_Z3": 1.0, "V": 0.89418, "N": 0.943155, "S": 0.056845, "Df": 9.015142, "GS": 129.417986, "RT": 2.61803, "goldenscore": 0.953481, "spec_quality": 0.833083, "prompt_quality": 1.0}, "report_path": "python\\runs\\auto_research\\20260629T095445785083Z\\report.json", "baseline_report_path": "python\\runs\\auto_research\\20260629T095307400468Z\\report.json", "ollama_suggestion": {"raw_response": "", "model_used": null, "_parse_error": "ollama call failed: All Ollama models failed: Local Ollama unavailable: ollama CLI is not available.", "models_seen": ["qwen25-base:latest", "qwen35-mmss:latest", "llama3:latest", "qwen-coder-3b-cpu:latest", "qwen-coder-7b-cpu:latest", "qwen2.5-coder:7b", "qwen2.5-coder:3b", "mmss-gemma4-mmss-json:latest", "mmss-gemma4-q4-creative:latest", "mmss-gemma4-q4:latest", "embeddinggemma:300m"], "requested_models": ["qwen-coder-3b-cpu:latest", "qwen2.5-coder:3b", "llama3"], "prompt_path": "D:\\project\\llm\\prompts\\work\\log_analysis.md"}, "ollama_suggestion_raw": "", "ollama_model_used": null, "llm_context_snapshot": {"current_score": 0.947339, "target_score": 0.92, "epsilon": 0.0005, "plateau_limit": 3, "asset_kind": "config", "model": "qwen2.5-coder:3b", "models": ["qwen-coder-3b-cpu:latest", "qwen2.5-coder:3b", "llama3"]}, "summary_text": "asset=config change=config.delta_init: 0.72 -> 0.684 decision=reverted score=0.942450 V=0.89418 S=0.056845 clean=0.940344 energy=0.19813"}
{"round": 0, "timestamp": "2026-06-29T10:03:44.099096+00:00", "asset": "python\\configs\\active.yaml", "asset_kind": "config", "change_description": "config.delta_init: 0.72 -> 0.684", "baseline_score_before": 0.947339, "new_score": 0.94245, "decision": "reverted", "score_delta": -0.004889, "submetrics": {"test_acc_clean": 0.940344, "test_acc_perturbed": 0.909112, "inference_latency_ms": 46.5, "energy_rel_v4": 0.19813, "alpha": 1.253308, "delta": 0.734, "alpha_delta_ratio": 1.707505, "eta_tern": 1.0, "zeta_Z3": 1.0, "V": 0.89418, "N": 0.943155, "S": 0.056845, "Df": 9.015142, "GS": 129.417986, "RT": 2.61803, "goldenscore": 0.953481, "spec_quality": 0.833083, "prompt_quality": 1.0}, "report_path": "python\\runs\\auto_research\\20260629T100344094597Z\\report.json", "baseline_report_path": "python\\runs\\auto_research\\20260629T100344070247Z\\report.json", "ollama_suggestion": null, "ollama_suggestion_raw": null, "ollama_model_used": null, "llm_context_snapshot": {"current_score": 0.947339, "target_score": 0.92, "epsilon": 0.0005, "plateau_limit": 3, "asset_kind": "config", "model": "qwen35-mmss:latest", "models": ["qwen-coder-3b-cpu:latest", "qwen2.5-coder:3b", "llama3"]}, "summary_text": "asset=config change=config.delta_init: 0.72 -> 0.684 decision=reverted score=0.942450 V=0.89418 S=0.056845 clean=0.940344 energy=0.19813"}
{"round": 0, "timestamp": "2026-06-29T10:11:14.140753+00:00", "asset": "python\\configs\\active.yaml", "asset_kind": "config", "change_description": "config.delta_init: 0.72 -> 0.684", "baseline_score_before": 0.947339, "new_score": 0.94245, "decision": "reverted", "score_delta": -0.004889, "submetrics": {"test_acc_clean": 0.940344, "test_acc_perturbed": 0.909112, "inference_latency_ms": 46.5, "energy_rel_v4": 0.19813, "alpha": 1.253308, "delta": 0.734, "alpha_delta_ratio": 1.707505, "eta_tern": 1.0, "zeta_Z3": 1.0, "V": 0.89418, "N": 0.943155, "S": 0.056845, "Df": 9.015142, "GS": 129.417986, "RT": 2.61803, "goldenscore": 0.953481, "spec_quality": 0.833083, "prompt_quality": 1.0}, "report_path": "python\\runs\\auto_research\\20260629T101114132057Z\\report.json", "baseline_report_path": "python\\runs\\auto_research\\20260629T100907806844Z\\report.json", "ollama_suggestion": {"raw_response": "", "model_used": "qwen-coder-3b-cpu:latest", "_parse_error": "Expecting value: line 1 column 1 (char 0)", "models_seen": ["qwen25-base:latest", "qwen35-mmss:latest", "llama3:latest", "qwen-coder-3b-cpu:latest", "qwen-coder-7b-cpu:latest", "qwen2.5-coder:7b", "qwen2.5-coder:3b", "mmss-gemma4-mmss-json:latest", "mmss-gemma4-q4-creative:latest", "mmss-gemma4-q4:latest", "embeddinggemma:300m"], "requested_models": ["qwen-coder-3b-cpu:latest", "qwen2.5-coder:3b", "llama3"], "prompt_path": "D:\\project\\llm\\prompts\\work\\log_analysis.md"}, "ollama_suggestion_raw": "", "ollama_model_used": "qwen-coder-3b-cpu:latest", "llm_context_snapshot": {"current_score": 0.947339, "target_score": 0.92, "epsilon": 0.0005, "plateau_limit": 3, "asset_kind": "config", "model": "llama3:latest", "models": ["qwen-coder-3b-cpu:latest", "qwen2.5-coder:3b", "llama3"]}, "summary_text": "asset=config change=config.delta_init: 0.72 -> 0.684 decision=reverted score=0.942450 V=0.89418 S=0.056845 clean=0.940344 energy=0.19813 model=qwen-coder-3b-cpu:latest"}
{"round": 0, "timestamp": "2026-06-29T10:33:07.607916+00:00", "asset": "python\\configs\\active.yaml", "asset_kind": "config", "change_description": "config.delta_init: 0.72 -> 0.684", "baseline_score_before": 0.947339, "new_score": 0.94245, "decision": "reverted", "score_delta": -0.004889, "submetrics": {"test_acc_clean": 0.940344, "test_acc_perturbed": 0.909112, "inference_latency_ms": 46.5, "energy_rel_v4": 0.19813, "alpha": 1.253308, "delta": 0.734, "alpha_delta_ratio": 1.707505, "eta_tern": 1.0, "zeta_Z3": 1.0, "V": 0.89418, "N": 0.943155, "S": 0.056845, "Df": 9.015142, "GS": 129.417986, "RT": 2.61803, "goldenscore": 0.953481, "spec_quality": 0.833083, "prompt_quality": 1.0}, "report_path": "python\\runs\\auto_research\\20260629T103307603405Z\\report.json", "baseline_report_path": "python\\runs\\auto_research\\20260629T103027199907Z\\report.json", "ollama_suggestion": {"raw_response": "{\"protocol_id\": \"protocol/v1.0\",\n\"version\": \"1.0\",\n\"identification\": {\"operation_id\": \"configuration_rebuild\", \"source_version\u001b[15D\u001b[K\n\"source_version\": \"2.0\", \"identity\": {\"project_name\": \"AIMS\", ...},\n\"change_management\": {\n\"changeswГјnscore\": [\n\"config.delta_init: +0.72 в†’ +0.48 (acceleration)\",\n\"...}],\n\"final_report\": {\n\"rebuild_complete\": true,\n\"complete_safety_check\": true,\n\"version\": \"aimed_at_105s_with_high_accuracy\",\n\"...\"}}\n}- Current config: {\n  \"change_type\": \"config.SYS_A->config.A_B transition\",\n  \"delta_init\": \"+0.72 в†’ +0.48 (acceleration)\",\n  \"entropy\": \"-0.34 в†’ -0.33 (stability)\",\n  \"scale\": \"A_A_A_A -> A_A_A_A\", ...},\n\"final_report_path\": \"/config_safety_check_v1.md\"\n}- Previous state: {\n  \"change_type\": \"configuration.A->configuration.A_B transition\",\n  \"delta_init\": \"+0.72 в†’ +0.48 (acceleration)\",\n  \"entropy\": \"-0.34 в†’ -0.33 (stability)\",\n  \"scale\": \"A_A_A_A -> A_A_A_A\", ...},\n\"final_report_path\": \"/configuration_safety_check_v1.md\"\n}- Previous score: 0.952876,\n- Final metrics: {\n  \"test_acc_clean\": 0.943002,\n  \"test_acc_perturbed\": 0.903002,\n  \"inference_latency_ms\": 46.5,\n  \"energy_rel_v4\": 0.187 (stable), ...}\n- Current config: {\n  \"change_type\": \"configuration.A->configuration.A_A transition\",\n  \"delta_init\": \"+0.72 в†’ +0.38 (acceleration)\",\n  \"entropy\": \"-0.34 в†’ -0.33 (stability)\",...", "model_used": "qwen25-base:latest", "_parse_error": "Invalid control character at: line 3 column 76 (char 126)", "models_seen": ["qwen25-base:latest", "qwen35-mmss:latest", "llama3:latest", "qwen-coder-3b-cpu:latest", "qwen-coder-7b-cpu:latest", "qwen2.5-coder:7b", "qwen2.5-coder:3b", "mmss-gemma4-mmss-json:latest", "mmss-gemma4-q4-creative:latest", "mmss-gemma4-q4:latest", "embeddinggemma:300m"], "requested_models": ["qwen25-base:latest"], "prompt_path": "D:\\project\\llm\\prompts\\work\\log_analysis.md"}, "ollama_suggestion_raw": "{\"protocol_id\": \"protocol/v1.0\",\n\"version\": \"1.0\",\n\"identification\": {\"operation_id\": \"configuration_rebuild\", \"source_version\u001b[15D\u001b[K\n\"source_version\": \"2.0\", \"identity\": {\"project_name\": \"AIMS\", ...},\n\"change_management\": {\n\"changeswГјnscore\": [\n\"config.delta_init: +0.72 в†’ +0.48 (acceleration)\",\n\"...}],\n\"final_report\": {\n\"rebuild_complete\": true,\n\"complete_safety_check\": true,\n\"version\": \"aimed_at_105s_with_high_accuracy\",\n\"...\"}}\n}- Current config: {\n  \"change_type\": \"config.SYS_A->config.A_B transition\",\n  \"delta_init\": \"+0.72 в†’ +0.48 (acceleration)\",\n  \"entropy\": \"-0.34 в†’ -0.33 (stability)\",\n  \"scale\": \"A_A_A_A -> A_A_A_A\", ...},\n\"final_report_path\": \"/config_safety_check_v1.md\"\n}- Previous state: {\n  \"change_type\": \"configuration.A->configuration.A_B transition\",\n  \"delta_init\": \"+0.72 в†’ +0.48 (acceleration)\",\n  \"entropy\": \"-0.34 в†’ -0.33 (stability)\",\n  \"scale\": \"A_A_A_A -> A_A_A_A\", ...},\n\"final_report_path\": \"/configuration_safety_check_v1.md\"\n}- Previous score: 0.952876,\n- Final metrics: {\n  \"test_acc_clean\": 0.943002,\n  \"test_acc_perturbed\": 0.903002,\n  \"inference_latency_ms\": 46.5,\n  \"energy_rel_v4\": 0.187 (stable), ...}\n- Current config: {\n  \"change_type\": \"configuration.A->configuration.A_A transition\",\n  \"delta_init\": \"+0.72 в†’ +0.38 (acceleration)\",\n  \"entropy\": \"-0.34 в†’ -0.33 (stability)\",...", "ollama_model_used": "qwen25-base:latest", "llm_context_snapshot": {"current_score": 0.947339, "target_score": 0.92, "epsilon": 0.0005, "plateau_limit": 3, "asset_kind": "config", "model": "qwen25-base:latest"}, "summary_text": "asset=config change=config.delta_init: 0.72 -> 0.684 decision=reverted score=0.942450 V=0.89418 S=0.056845 clean=0.940344 energy=0.19813 model=qwen25-base:latest"}
{"round": 0, "timestamp": "2026-06-29T10:52:43.844729+00:00", "asset": "python\\configs\\omega_loop_test.yaml", "asset_kind": "config", "change_description": "config.delta_init: 0.58 -> 0.551", "baseline_score_before": 0.770627, "new_score": 0.768616, "decision": "reverted", "score_delta": -0.002011, "submetrics": {"test_acc_clean": 0.78639, "test_acc_perturbed": 0.751812, "inference_latency_ms": 50.33, "energy_rel_v4": 0.27701, "alpha": 1.123033, "delta": 0.594563, "alpha_delta_ratio": 1.88884, "eta_tern": 0.981033, "zeta_Z3": 0.840458, "V": 0.789512, "N": 0.843438, "S": 0.156562, "Df": 9.023626, "GS": 116.08388, "RT": 2.61803, "goldenscore": 0.840527, "spec_quality": 0.830333, "prompt_quality": 0.87125}, "report_path": "python\\runs\\auto_research\\20260629T105243833704Z\\report.json", "baseline_report_path": "python\\runs\\auto_research\\20260629T104022556585Z\\report.json", "ollama_suggestion": {"raw_response": "Based on the provided log analysis prompt and data, I will analyze the chan\u001b[4D\u001b[K\nchanges and identify the smallest useful next change.\n\nThe goal is to find a change that is likely to improve the canonical score.\u001b[6D\u001b[K\nscore. To achieve this, we need to examine the submetrics and their trends \u001b[K\nover time.\n\nFrom the data, we can see that the test accuracy clean and perturbed have b\u001b[1D\u001b[K\nbeen improving steadily over time. This suggests that the current configura\u001b[9D\u001b[K\nconfiguration is trending towards better performance.\n\nLet's look at some specific metrics:\n\n* `test_acc_clean`: 0.940344 -> 0.943002 (improvement)\n* `inference_latency_ms`: 46.5 -> 50.33 (decrease)\n\nThese improvements in test accuracy and inference latency suggest that the \u001b[K\ncurrent configuration is on a good path.\n\nNow, let's examine some other submetrics:\n\n* `energy_rel_v4`: This metric has been steadily decreasing, which indicate\u001b[8D\u001b[K\nindicates a reduction in energy consumption.\n* `alpha`, `delta`, and `alpha_delta_ratio` have all decreased, suggesting \u001b[K\nthat the model is becoming more stable.\n\nGiven these trends, I recommend the smallest useful next change to be:\n\n```\n{\n  \"asset\": \"config\",\n  \"field\": \"delta_init\",\n  \"direction\": \"-0.02\",\n  \"magnitude\": 0.58,\n  \"reason\": \"Further stabilization of the model\"\n}\n```\n\nThis change aims to further stabilize the model by reducing the `delta_init\u001b[11D\u001b[K\n`delta_init` value. This should help to maintain the current trend of impro\u001b[5D\u001b[K\nimproving test accuracy and reduce inference latency.\n\nNote that this recommendation is based on a thorough analysis of the log da\u001b[2D\u001b[K\ndata and submetrics. The actual best next change may depend on other factor\u001b[6D\u001b[K\nfactors not considered in this prompt.", "model_used": "llama3:latest", "_parse_error": "Expecting value: line 1 column 1 (char 0)", "models_seen": ["qwen25-base:latest", "qwen35-mmss:latest", "llama3:latest", "qwen-coder-3b-cpu:latest", "qwen-coder-7b-cpu:latest", "qwen2.5-coder:7b", "qwen2.5-coder:3b", "mmss-gemma4-mmss-json:latest", "mmss-gemma4-q4-creative:latest", "mmss-gemma4-q4:latest", "embeddinggemma:300m"], "requested_models": ["llama3:latest"], "prompt_path": "D:\\project\\llm\\prompts\\work\\log_analysis.md"}, "ollama_suggestion_raw": "Based on the provided log analysis prompt and data, I will analyze the chan\u001b[4D\u001b[K\nchanges and identify the smallest useful next change.\n\nThe goal is to find a change that is likely to improve the canonical score.\u001b[6D\u001b[K\nscore. To achieve this, we need to examine the submetrics and their trends \u001b[K\nover time.\n\nFrom the data, we can see that the test accuracy clean and perturbed have b\u001b[1D\u001b[K\nbeen improving steadily over time. This suggests that the current configura\u001b[9D\u001b[K\nconfiguration is trending towards better performance.\n\nLet's look at some specific metrics:\n\n* `test_acc_clean`: 0.940344 -> 0.943002 (improvement)\n* `inference_latency_ms`: 46.5 -> 50.33 (decrease)\n\nThese improvements in test accuracy and inference latency suggest that the \u001b[K\ncurrent configuration is on a good path.\n\nNow, let's examine some other submetrics:\n\n* `energy_rel_v4`: This metric has been steadily decreasing, which indicate\u001b[8D\u001b[K\nindicates a reduction in energy consumption.\n* `alpha`, `delta`, and `alpha_delta_ratio` have all decreased, suggesting \u001b[K\nthat the model is becoming more stable.\n\nGiven these trends, I recommend the smallest useful next change to be:\n\n```\n{\n  \"asset\": \"config\",\n  \"field\": \"delta_init\",\n  \"direction\": \"-0.02\",\n  \"magnitude\": 0.58,\n  \"reason\": \"Further stabilization of the model\"\n}\n```\n\nThis change aims to further stabilize the model by reducing the `delta_init\u001b[11D\u001b[K\n`delta_init` value. This should help to maintain the current trend of impro\u001b[5D\u001b[K\nimproving test accuracy and reduce inference latency.\n\nNote that this recommendation is based on a thorough analysis of the log da\u001b[2D\u001b[K\ndata and submetrics. The actual best next change may depend on other factor\u001b[6D\u001b[K\nfactors not considered in this prompt.", "ollama_model_used": "llama3:latest", "llm_context_snapshot": {"current_score": 0.770627, "target_score": 0.92, "epsilon": 0.0005, "plateau_limit": 3, "asset_kind": "config", "model": "llama3:latest"}, "summary_text": "asset=config change=config.delta_init: 0.58 -> 0.551 decision=reverted score=0.768616 V=0.789512 S=0.156562 clean=0.78639 energy=0.27701 model=llama3:latest"}
