{"round": 0, "timestamp": "2026-06-29T00:29:57.455433+00:00", "asset": "D:\\project\\python\\configs\\omega_loop_test.yaml", "asset_kind": "config", "change_description": "config.delta_init: 0.58 -> 0.551", "baseline_score_before": 0.770627, "new_score": 0.768616, "decision": "reverted", "score_delta": -0.002011, "submetrics": {"test_acc_clean": 0.78639, "test_acc_perturbed": 0.751812, "inference_latency_ms": 50.33, "energy_rel_v4": 0.27701, "alpha": 1.123033, "delta": 0.594563, "alpha_delta_ratio": 1.88884, "eta_tern": 0.981033, "zeta_Z3": 0.840458, "V": 0.789512, "N": 0.843438, "S": 0.156562, "Df": 9.023626, "GS": 116.08388, "RT": 2.61803, "goldenscore": 0.840527, "spec_quality": 0.830333, "prompt_quality": 0.87125}, "report_path": "python\\runs\\auto_research\\20260629T002957Z\\report.json", "baseline_report_path": "python\\runs\\auto_research\\20260629T002957Z\\report.json", "ollama_suggestion": null}
{"round": 1, "timestamp": "2026-06-29T00:29:57.503477+00:00", "asset": "D:\\project\\mmss_specs\\MMSSPHYSIC20FORMALIZEDv2.json", "asset_kind": "mmss_spec", "change_description": "unifiedmetrics.RT: 2.61803 -> 2.61803", "baseline_score_before": 0.770627, "new_score": 0.76911, "decision": "reverted", "score_delta": -0.001517, "submetrics": {"test_acc_clean": 0.7865, "test_acc_perturbed": 0.751921, "inference_latency_ms": 50.33, "energy_rel_v4": 0.270932, "alpha": 1.11964, "delta": 0.623563, "alpha_delta_ratio": 1.795554, "eta_tern": 0.97764, "zeta_Z3": 0.840458, "V": 0.778274, "N": 0.843488, "S": 0.156512, "Df": 9.025882, "GS": 114.875257, "RT": 2.61803, "goldenscore": 0.83651, "spec_quality": 0.7964, "prompt_quality": 0.87125}, "report_path": "python\\runs\\auto_research\\20260629T002957Z\\report.json", "baseline_report_path": "python\\runs\\auto_research\\20260629T002957Z\\report.json", "ollama_suggestion": null}
{"round": 2, "timestamp": "2026-06-29T00:29:57.528317+00:00", "asset": "D:\\project\\llm\\prompts\\log_analysis.md", "asset_kind": "prompt", "change_description": "prompt_text: length 414 -> 482", "baseline_score_before": 0.770627, "new_score": 0.771456, "decision": "kept", "score_delta": 0.000829, "submetrics": {"test_acc_clean": 0.787986, "test_acc_perturbed": 0.753407, "inference_latency_ms": 50.33, "energy_rel_v4": 0.26686, "alpha": 1.123033, "delta": 0.625687, "alpha_delta_ratio": 1.794879, "eta_tern": 0.981033, "zeta_Z3": 0.844708, "V": 0.790576, "N": 0.846281, "S": 0.153719, "Df": 9.023541, "GS": 116.254007, "RT": 2.61803, "goldenscore": 0.842175, "spec_quality": 0.830333, "prompt_quality": 0.91375}, "report_path": "python\\runs\\auto_research\\20260629T002957Z\\report.json", "baseline_report_path": "python\\runs\\auto_research\\20260629T002957Z\\report.json", "ollama_suggestion": null}
{"round": 0, "timestamp": "2026-06-29T00:38:42.639234+00:00", "asset": "D:\\project\\python\\configs\\omega_loop_test.yaml", "asset_kind": "config", "change_description": "config.delta_init: 0.58 -> 0.551", "baseline_score_before": 0.770627, "new_score": 0.769445, "decision": "reverted", "score_delta": -0.001182, "submetrics": {"test_acc_clean": 0.787028, "test_acc_perturbed": 0.752449, "inference_latency_ms": 50.33, "energy_rel_v4": 0.27701, "alpha": 1.123033, "delta": 0.596688, "alpha_delta_ratio": 1.882113, "eta_tern": 0.981033, "zeta_Z3": 0.844708, "V": 0.789937, "N": 0.84585, "S": 0.15415, "Df": 9.023592, "GS": 116.19013, "RT": 2.61803, "goldenscore": 0.841696, "spec_quality": 0.830333, "prompt_quality": 0.91375}, "report_path": "python\\runs\\auto_research\\20260629T003841Z\\report.json", "baseline_report_path": "python\\runs\\auto_research\\20260629T002603Z\\report.json", "ollama_suggestion": null}
{"round": 0, "timestamp": "2026-06-29T00:41:55.983881+00:00", "asset": "D:\\project\\python\\configs\\omega_loop_test.yaml", "asset_kind": "config", "change_description": "config.delta_init: 0.58 -> 0.551", "baseline_score_before": 0.770627, "new_score": 0.769445, "decision": "reverted", "score_delta": -0.001182, "submetrics": {"test_acc_clean": 0.787028, "test_acc_perturbed": 0.752449, "inference_latency_ms": 50.33, "energy_rel_v4": 0.27701, "alpha": 1.123033, "delta": 0.596688, "alpha_delta_ratio": 1.882113, "eta_tern": 0.981033, "zeta_Z3": 0.844708, "V": 0.789937, "N": 0.84585, "S": 0.15415, "Df": 9.023592, "GS": 116.19013, "RT": 2.61803, "goldenscore": 0.841696, "spec_quality": 0.830333, "prompt_quality": 0.91375}, "report_path": "python\\runs\\auto_research\\20260629T004155Z\\report.json", "baseline_report_path": "python\\runs\\auto_research\\20260629T002823Z\\report.json", "ollama_suggestion": null}
{"round": 1, "timestamp": "2026-06-29T00:45:24.895614+00:00", "asset": "D:\\project\\mmss_specs\\MMSSPHYSIC20FORMALIZEDv2.json", "asset_kind": "mmss_spec", "change_description": "unifiedmetrics.RT: 2.61803 -> 2.61803", "baseline_score_before": 0.770627, "new_score": 0.769939, "decision": "reverted", "score_delta": -0.000688, "submetrics": {"test_acc_clean": 0.787138, "test_acc_perturbed": 0.752559, "inference_latency_ms": 50.33, "energy_rel_v4": 0.270932, "alpha": 1.11964, "delta": 0.625687, "alpha_delta_ratio": 1.789456, "eta_tern": 0.97764, "zeta_Z3": 0.844708, "V": 0.778699, "N": 0.845899, "S": 0.154101, "Df": 9.025848, "GS": 114.981507, "RT": 2.61803, "goldenscore": 0.837678, "spec_quality": 0.7964, "prompt_quality": 0.91375}, "report_path": "python\\runs\\auto_research\\20260629T004524Z\\report.json", "baseline_report_path": "python\\runs\\auto_research\\20260629T002603Z\\report.json", "ollama_suggestion": null}
{"round": 2, "timestamp": "2026-06-29T00:49:24.562184+00:00", "asset": "D:\\project\\llm\\prompts\\log_analysis.md", "asset_kind": "prompt", "change_description": "prompt_text: length 482 -> 482", "baseline_score_before": 0.770627, "new_score": 0.771456, "decision": "kept", "score_delta": 0.000829, "submetrics": {"test_acc_clean": 0.787986, "test_acc_perturbed": 0.753407, "inference_latency_ms": 50.33, "energy_rel_v4": 0.26686, "alpha": 1.123033, "delta": 0.625687, "alpha_delta_ratio": 1.794879, "eta_tern": 0.981033, "zeta_Z3": 0.844708, "V": 0.790576, "N": 0.846281, "S": 0.153719, "Df": 9.023541, "GS": 116.254007, "RT": 2.61803, "goldenscore": 0.842175, "spec_quality": 0.830333, "prompt_quality": 0.91375}, "report_path": "python\\runs\\auto_research\\20260629T004924Z\\report.json", "baseline_report_path": "python\\runs\\auto_research\\20260629T004924Z\\report.json", "ollama_suggestion": null}
{"round": 1, "timestamp": "2026-06-29T00:49:24.677574+00:00", "asset": "D:\\project\\mmss_specs\\MMSSPHYSIC20FORMALIZEDv2.json", "asset_kind": "mmss_spec", "change_description": "unifiedmetrics.RT: 2.61803 -> 2.61803", "baseline_score_before": 0.770627, "new_score": 0.769939, "decision": "reverted", "score_delta": -0.000688, "submetrics": {"test_acc_clean": 0.787138, "test_acc_perturbed": 0.752559, "inference_latency_ms": 50.33, "energy_rel_v4": 0.270932, "alpha": 1.11964, "delta": 0.625687, "alpha_delta_ratio": 1.789456, "eta_tern": 0.97764, "zeta_Z3": 0.844708, "V": 0.778699, "N": 0.845899, "S": 0.154101, "Df": 9.025848, "GS": 114.981507, "RT": 2.61803, "goldenscore": 0.837678, "spec_quality": 0.7964, "prompt_quality": 0.91375}, "report_path": "python\\runs\\auto_research\\20260629T004924Z\\report.json", "baseline_report_path": "python\\runs\\auto_research\\20260629T002823Z\\report.json", "ollama_suggestion": null}
{"round": 2, "timestamp": "2026-06-29T00:49:25.903753+00:00", "asset": "D:\\project\\llm\\prompts\\log_analysis.md", "asset_kind": "prompt", "change_description": "prompt_text: length 482 -> 482", "baseline_score_before": 0.770627, "new_score": 0.771456, "decision": "kept", "score_delta": 0.000829, "submetrics": {"test_acc_clean": 0.787986, "test_acc_perturbed": 0.753407, "inference_latency_ms": 50.33, "energy_rel_v4": 0.26686, "alpha": 1.123033, "delta": 0.625687, "alpha_delta_ratio": 1.794879, "eta_tern": 0.981033, "zeta_Z3": 0.844708, "V": 0.790576, "N": 0.846281, "S": 0.153719, "Df": 9.023541, "GS": 116.254007, "RT": 2.61803, "goldenscore": 0.842175, "spec_quality": 0.830333, "prompt_quality": 0.91375}, "report_path": "python\\runs\\auto_research\\20260629T004925Z\\report.json", "baseline_report_path": "python\\runs\\auto_research\\20260629T004925Z\\report.json", "ollama_suggestion": null}
{"round": 0, "timestamp": "2026-06-29T09:11:57.117680+00:00", "asset": "python\\configs\\active.yaml", "asset_kind": "config", "change_description": "config.delta_init: 0.72 -> 0.684", "baseline_score_before": 0.947339, "new_score": 0.94245, "decision": "reverted", "score_delta": -0.004889, "submetrics": {"test_acc_clean": 0.940344, "test_acc_perturbed": 0.909112, "inference_latency_ms": 46.5, "energy_rel_v4": 0.19813, "alpha": 1.253308, "delta": 0.734, "alpha_delta_ratio": 1.707505, "eta_tern": 1.0, "zeta_Z3": 1.0, "V": 0.89418, "N": 0.943155, "S": 0.056845, "Df": 9.015142, "GS": 129.417986, "RT": 2.61803, "goldenscore": 0.953481, "spec_quality": 0.833083, "prompt_quality": 1.0}, "report_path": "python\\runs\\auto_research\\20260629T091157111123Z\\report.json", "baseline_report_path": "python\\runs\\auto_research\\20260629T091157069178Z\\report.json", "ollama_suggestion": null, "ollama_suggestion_raw": null, "ollama_model_used": null, "llm_context_snapshot": {"current_score": 0.947339, "target_score": 0.92, "epsilon": 0.0005, "plateau_limit": 3, "asset_kind": "config", "model": "qwen-35-mmss:latest", "models": ["qwen25-base:latest", "qwen-coder-3b-cpu:latest", "qwen2.5-coder:3b"]}, "summary_text": "asset=config change=config.delta_init: 0.72 -> 0.684 decision=reverted score=0.942450 V=0.89418 S=0.056845 clean=0.940344 energy=0.19813"}
{"round": 0, "timestamp": "2026-06-29T09:13:38.917403+00:00", "asset": "python\\configs\\active.yaml", "asset_kind": "config", "change_description": "config.delta_init: 0.72 -> 0.684", "baseline_score_before": 0.947339, "new_score": 0.94245, "decision": "reverted", "score_delta": -0.004889, "submetrics": {"test_acc_clean": 0.940344, "test_acc_perturbed": 0.909112, "inference_latency_ms": 46.5, "energy_rel_v4": 0.19813, "alpha": 1.253308, "delta": 0.734, "alpha_delta_ratio": 1.707505, "eta_tern": 1.0, "zeta_Z3": 1.0, "V": 0.89418, "N": 0.943155, "S": 0.056845, "Df": 9.015142, "GS": 129.417986, "RT": 2.61803, "goldenscore": 0.953481, "spec_quality": 0.833083, "prompt_quality": 1.0}, "report_path": "python\\runs\\auto_research\\20260629T091338913752Z\\report.json", "baseline_report_path": "python\\runs\\auto_research\\20260629T091338896086Z\\report.json", "ollama_suggestion": null, "ollama_suggestion_raw": null, "ollama_model_used": null, "llm_context_snapshot": {"current_score": 0.947339, "target_score": 0.92, "epsilon": 0.0005, "plateau_limit": 3, "asset_kind": "config", "model": "qwen35-mmss:latest", "models": ["qwen25-base:latest", "qwen-coder-3b-cpu:latest", "qwen2.5-coder:3b"]}, "summary_text": "asset=config change=config.delta_init: 0.72 -> 0.684 decision=reverted score=0.942450 V=0.89418 S=0.056845 clean=0.940344 energy=0.19813"}
{"round": 0, "timestamp": "2026-06-29T09:14:11.940296+00:00", "asset": "python\\configs\\active.yaml", "asset_kind": "config", "change_description": "config.delta_init: 0.72 -> 0.684", "baseline_score_before": 0.947339, "new_score": 0.94245, "decision": "reverted", "score_delta": -0.004889, "submetrics": {"test_acc_clean": 0.940344, "test_acc_perturbed": 0.909112, "inference_latency_ms": 46.5, "energy_rel_v4": 0.19813, "alpha": 1.253308, "delta": 0.734, "alpha_delta_ratio": 1.707505, "eta_tern": 1.0, "zeta_Z3": 1.0, "V": 0.89418, "N": 0.943155, "S": 0.056845, "Df": 9.015142, "GS": 129.417986, "RT": 2.61803, "goldenscore": 0.953481, "spec_quality": 0.833083, "prompt_quality": 1.0}, "report_path": "python\\runs\\auto_research\\20260629T091411936545Z\\report.json", "baseline_report_path": "python\\runs\\auto_research\\20260629T091411919162Z\\report.json", "ollama_suggestion": null, "ollama_suggestion_raw": null, "ollama_model_used": null, "llm_context_snapshot": {"current_score": 0.947339, "target_score": 0.92, "epsilon": 0.0005, "plateau_limit": 3, "asset_kind": "config", "model": "qwen35-mmss:latest", "models": ["qwen25-base:latest", "qwen-coder-3b-cpu:latest", "qwen2.5-coder:3b"]}, "summary_text": "asset=config change=config.delta_init: 0.72 -> 0.684 decision=reverted score=0.942450 V=0.89418 S=0.056845 clean=0.940344 energy=0.19813"}
{"round": 0, "timestamp": "2026-06-29T09:17:26.527465+00:00", "asset": "python\\configs\\active.yaml", "asset_kind": "config", "change_description": "config.delta_init: 0.72 -> 0.684", "baseline_score_before": 0.947339, "new_score": 0.94245, "decision": "reverted", "score_delta": -0.004889, "submetrics": {"test_acc_clean": 0.940344, "test_acc_perturbed": 0.909112, "inference_latency_ms": 46.5, "energy_rel_v4": 0.19813, "alpha": 1.253308, "delta": 0.734, "alpha_delta_ratio": 1.707505, "eta_tern": 1.0, "zeta_Z3": 1.0, "V": 0.89418, "N": 0.943155, "S": 0.056845, "Df": 9.015142, "GS": 129.417986, "RT": 2.61803, "goldenscore": 0.953481, "spec_quality": 0.833083, "prompt_quality": 1.0}, "report_path": "python\\runs\\auto_research\\20260629T091726507614Z\\report.json", "baseline_report_path": "python\\runs\\auto_research\\20260629T091726480671Z\\report.json", "ollama_suggestion": null, "ollama_suggestion_raw": null, "ollama_model_used": null, "llm_context_snapshot": {"current_score": 0.947339, "target_score": 0.92, "epsilon": 0.0005, "plateau_limit": 3, "asset_kind": "config", "model": "qwen35-mmss:latest", "models": ["qwen25-base:latest", "qwen-coder-3b-cpu:latest", "qwen2.5-coder:3b"]}, "summary_text": "asset=config change=config.delta_init: 0.72 -> 0.684 decision=reverted score=0.942450 V=0.89418 S=0.056845 clean=0.940344 energy=0.19813"}
{"round": 0, "timestamp": "2026-06-29T09:25:24.638362+00:00", "asset": "python\\configs\\active.yaml", "asset_kind": "config", "change_description": "config.delta_init: 0.72 -> 0.684", "baseline_score_before": 0.947339, "new_score": 0.94245, "decision": "reverted", "score_delta": -0.004889, "submetrics": {"test_acc_clean": 0.940344, "test_acc_perturbed": 0.909112, "inference_latency_ms": 46.5, "energy_rel_v4": 0.19813, "alpha": 1.253308, "delta": 0.734, "alpha_delta_ratio": 1.707505, "eta_tern": 1.0, "zeta_Z3": 1.0, "V": 0.89418, "N": 0.943155, "S": 0.056845, "Df": 9.015142, "GS": 129.417986, "RT": 2.61803, "goldenscore": 0.953481, "spec_quality": 0.833083, "prompt_quality": 1.0}, "report_path": "python\\runs\\auto_research\\20260629T092524634009Z\\report.json", "baseline_report_path": "python\\runs\\auto_research\\20260629T092524610979Z\\report.json", "ollama_suggestion": null, "ollama_suggestion_raw": null, "ollama_model_used": null, "llm_context_snapshot": {"current_score": 0.947339, "target_score": 0.92, "epsilon": 0.0005, "plateau_limit": 3, "asset_kind": "config", "model": "qwen35-mmss:latest", "models": ["qwen25-base:latest", "qwen-coder-3b-cpu:latest", "qwen2.5-coder:3b"]}, "summary_text": "asset=config change=config.delta_init: 0.72 -> 0.684 decision=reverted score=0.942450 V=0.89418 S=0.056845 clean=0.940344 energy=0.19813"}
{"round": 0, "timestamp": "2026-06-29T09:34:42.120834+00:00", "asset": "python\\configs\\active.yaml", "asset_kind": "config", "change_description": "config.delta_init: 0.72 -> 0.684", "baseline_score_before": 0.947339, "new_score": 0.94245, "decision": "reverted", "score_delta": -0.004889, "submetrics": {"test_acc_clean": 0.940344, "test_acc_perturbed": 0.909112, "inference_latency_ms": 46.5, "energy_rel_v4": 0.19813, "alpha": 1.253308, "delta": 0.734, "alpha_delta_ratio": 1.707505, "eta_tern": 1.0, "zeta_Z3": 1.0, "V": 0.89418, "N": 0.943155, "S": 0.056845, "Df": 9.015142, "GS": 129.417986, "RT": 2.61803, "goldenscore": 0.953481, "spec_quality": 0.833083, "prompt_quality": 1.0}, "report_path": "python\\runs\\auto_research\\20260629T093442105831Z\\report.json", "baseline_report_path": "python\\runs\\auto_research\\20260629T093442023628Z\\report.json", "ollama_suggestion": null, "ollama_suggestion_raw": null, "ollama_model_used": null, "llm_context_snapshot": {"current_score": 0.947339, "target_score": 0.92, "epsilon": 0.0005, "plateau_limit": 3, "asset_kind": "config", "model": "qwen25-base:latest", "models": ["qwen-coder-3b-cpu:latest", "qwen2.5-coder:3b", "llama3"]}, "summary_text": "asset=config change=config.delta_init: 0.72 -> 0.684 decision=reverted score=0.942450 V=0.89418 S=0.056845 clean=0.940344 energy=0.19813"}
{"round": 0, "timestamp": "2026-06-29T09:35:23.110688+00:00", "asset": "python\\configs\\active.yaml", "asset_kind": "config", "change_description": "config.delta_init: 0.72 -> 0.684", "baseline_score_before": 0.947339, "new_score": 0.94245, "decision": "reverted", "score_delta": -0.004889, "submetrics": {"test_acc_clean": 0.940344, "test_acc_perturbed": 0.909112, "inference_latency_ms": 46.5, "energy_rel_v4": 0.19813, "alpha": 1.253308, "delta": 0.734, "alpha_delta_ratio": 1.707505, "eta_tern": 1.0, "zeta_Z3": 1.0, "V": 0.89418, "N": 0.943155, "S": 0.056845, "Df": 9.015142, "GS": 129.417986, "RT": 2.61803, "goldenscore": 0.953481, "spec_quality": 0.833083, "prompt_quality": 1.0}, "report_path": "python\\runs\\auto_research\\20260629T093523061335Z\\report.json", "baseline_report_path": "python\\runs\\auto_research\\20260629T093523017387Z\\report.json", "ollama_suggestion": null, "ollama_suggestion_raw": null, "ollama_model_used": null, "llm_context_snapshot": {"current_score": 0.947339, "target_score": 0.92, "epsilon": 0.0005, "plateau_limit": 3, "asset_kind": "config", "model": "qwen25-base:latest", "models": ["qwen-coder-3b-cpu:latest", "qwen2.5-coder:3b", "llama3"]}, "summary_text": "asset=config change=config.delta_init: 0.72 -> 0.684 decision=reverted score=0.942450 V=0.89418 S=0.056845 clean=0.940344 energy=0.19813"}
{"round": 0, "timestamp": "2026-06-29T09:36:59.363584+00:00", "asset": "python\\configs\\active.yaml", "asset_kind": "config", "change_description": "config.delta_init: 0.72 -> 0.684", "baseline_score_before": 0.947339, "new_score": 0.94245, "decision": "reverted", "score_delta": -0.004889, "submetrics": {"test_acc_clean": 0.940344, "test_acc_perturbed": 0.909112, "inference_latency_ms": 46.5, "energy_rel_v4": 0.19813, "alpha": 1.253308, "delta": 0.734, "alpha_delta_ratio": 1.707505, "eta_tern": 1.0, "zeta_Z3": 1.0, "V": 0.89418, "N": 0.943155, "S": 0.056845, "Df": 9.015142, "GS": 129.417986, "RT": 2.61803, "goldenscore": 0.953481, "spec_quality": 0.833083, "prompt_quality": 1.0}, "report_path": "python\\runs\\auto_research\\20260629T093659331337Z\\report.json", "baseline_report_path": "python\\runs\\auto_research\\20260629T093659272531Z\\report.json", "ollama_suggestion": null, "ollama_suggestion_raw": null, "ollama_model_used": null, "llm_context_snapshot": {"current_score": 0.947339, "target_score": 0.92, "epsilon": 0.0005, "plateau_limit": 3, "asset_kind": "config", "model": "qwen25-base:latest", "models": ["qwen-coder-3b-cpu:latest", "qwen2.5-coder:3b", "llama3"]}, "summary_text": "asset=config change=config.delta_init: 0.72 -> 0.684 decision=reverted score=0.942450 V=0.89418 S=0.056845 clean=0.940344 energy=0.19813"}
{"round": 0, "timestamp": "2026-06-29T09:38:13.365920+00:00", "asset": "python\\configs\\active.yaml", "asset_kind": "config", "change_description": "config.delta_init: 0.72 -> 0.684", "baseline_score_before": 0.947339, "new_score": 0.94245, "decision": "reverted", "score_delta": -0.004889, "submetrics": {"test_acc_clean": 0.940344, "test_acc_perturbed": 0.909112, "inference_latency_ms": 46.5, "energy_rel_v4": 0.19813, "alpha": 1.253308, "delta": 0.734, "alpha_delta_ratio": 1.707505, "eta_tern": 1.0, "zeta_Z3": 1.0, "V": 0.89418, "N": 0.943155, "S": 0.056845, "Df": 9.015142, "GS": 129.417986, "RT": 2.61803, "goldenscore": 0.953481, "spec_quality": 0.833083, "prompt_quality": 1.0}, "report_path": "python\\runs\\auto_research\\20260629T093813361625Z\\report.json", "baseline_report_path": "python\\runs\\auto_research\\20260629T093813340848Z\\report.json", "ollama_suggestion": null, "ollama_suggestion_raw": null, "ollama_model_used": null, "llm_context_snapshot": {"current_score": 0.947339, "target_score": 0.92, "epsilon": 0.0005, "plateau_limit": 3, "asset_kind": "config", "model": "qwen25-base:latest", "models": ["qwen-coder-3b-cpu:latest", "qwen2.5-coder:3b", "llama3"]}, "summary_text": "asset=config change=config.delta_init: 0.72 -> 0.684 decision=reverted score=0.942450 V=0.89418 S=0.056845 clean=0.940344 energy=0.19813"}
{"round": 0, "timestamp": "2026-06-29T09:40:07.886662+00:00", "asset": "python\\configs\\active.yaml", "asset_kind": "config", "change_description": "config.delta_init: 0.72 -> 0.684", "baseline_score_before": 0.947339, "new_score": 0.94245, "decision": "reverted", "score_delta": -0.004889, "submetrics": {"test_acc_clean": 0.940344, "test_acc_perturbed": 0.909112, "inference_latency_ms": 46.5, "energy_rel_v4": 0.19813, "alpha": 1.253308, "delta": 0.734, "alpha_delta_ratio": 1.707505, "eta_tern": 1.0, "zeta_Z3": 1.0, "V": 0.89418, "N": 0.943155, "S": 0.056845, "Df": 9.015142, "GS": 129.417986, "RT": 2.61803, "goldenscore": 0.953481, "spec_quality": 0.833083, "prompt_quality": 1.0}, "report_path": "python\\runs\\auto_research\\20260629T094007872090Z\\report.json", "baseline_report_path": "python\\runs\\auto_research\\20260629T094007847497Z\\report.json", "ollama_suggestion": null, "ollama_suggestion_raw": null, "ollama_model_used": null, "llm_context_snapshot": {"current_score": 0.947339, "target_score": 0.92, "epsilon": 0.0005, "plateau_limit": 3, "asset_kind": "config", "model": "llama3:latest", "models": ["qwen25-base:latest", "qwen35-mmss:latest", "qwen-coder-3b-cpu:latest"]}, "summary_text": "asset=config change=config.delta_init: 0.72 -> 0.684 decision=reverted score=0.942450 V=0.89418 S=0.056845 clean=0.940344 energy=0.19813"}
