{"round": 5, "timestamp": "2026-06-29T11:30:09.042003+00:00", "asset": "D:\\project\\llm\\prompts\\work\\log_analysis.md", "asset_kind": "prompt", "change_description": "prompt_text: length 482 -> 482", "baseline_score_before": 0.771456, "new_score": 0.771456, "decision": "reverted", "score_delta": 0.0, "submetrics": {"test_acc_clean": 0.787986, "test_acc_perturbed": 0.753407, "inference_latency_ms": 50.33, "energy_rel_v4": 0.26686, "alpha": 1.123033, "delta": 0.625687, "alpha_delta_ratio": 1.794879, "eta_tern": 0.981033, "zeta_Z3": 0.844708, "V": 0.790576, "N": 0.846281, "S": 0.153719, "Df": 9.023541, "GS": 116.254007, "RT": 2.61803, "goldenscore": 0.842175, "spec_quality": 0.830333, "prompt_quality": 0.91375}, "report_path": "python\\runs\\auto_research\\20260629T113009035684Z\\report.json", "baseline_report_path": "python\\runs\\auto_research\\20260629T110909860382Z\\report.json", "ollama_suggestion": {"raw_response": "Based on the log analysis, I would recommend the following smallest useful \u001b[K\nnext change:\n\n```\n{\n  \"asset\": \"config\",\n  \"field\": \"delta_init\",\n  \"direction\": \"-0.02\",\n  \"magnitude\": 0.58,\n  \"reason\": \"Further stabilization of the model\"\n}\n```\n\nThis recommendation is based on a thorough analysis of the log data and sub\u001b[3D\u001b[K\nsubmetrics. The current trend suggests that the model is becoming more stab\u001b[4D\u001b[K\nstable, as indicated by decreasing values for `alpha`, `delta`, and `alpha_\u001b[7D\u001b[K\n`alpha_delta_ratio`. Additionally, the test accuracy clean and perturbed ha\u001b[2D\u001b[K\nhave been improving steadily over time.\n\nBy reducing the `delta_init` value by 0.02, we aim to further stabilize the\u001b[3D\u001b[K\nthe model while maintaining the current trend of improving test accuracy. T\u001b[1D\u001b[K\nThis change is likely to improve the canonical score and preserve score det\u001b[3D\u001b[K\ndeterminism.\n\nNote that this recommendation does not consider other factors that may affe\u001b[4D\u001b[K\naffect the actual best next change, as these are not included in the provid\u001b[6D\u001b[K\nprovided prompt.", "model_used": "llama3:latest", "_parse_error": "Expecting value: line 1 column 1 (char 0)", "models_seen": ["qwen25-base:latest", "qwen35-mmss:latest", "llama3:latest", "qwen-coder-3b-cpu:latest", "qwen-coder-7b-cpu:latest", "qwen2.5-coder:7b", "qwen2.5-coder:3b", "mmss-gemma4-mmss-json:latest", "mmss-gemma4-q4-creative:latest", "mmss-gemma4-q4:latest", "embeddinggemma:300m"], "requested_models": ["llama3:latest"], "prompt_path": "D:\\project\\llm\\prompts\\work\\log_analysis.md"}, "ollama_suggestion_raw": "Based on the log analysis, I would recommend the following smallest useful \u001b[K\nnext change:\n\n```\n{\n  \"asset\": \"config\",\n  \"field\": \"delta_init\",\n  \"direction\": \"-0.02\",\n  \"magnitude\": 0.58,\n  \"reason\": \"Further stabilization of the model\"\n}\n```\n\nThis recommendation is based on a thorough analysis of the log data and sub\u001b[3D\u001b[K\nsubmetrics. The current trend suggests that the model is becoming more stab\u001b[4D\u001b[K\nstable, as indicated by decreasing values for `alpha`, `delta`, and `alpha_\u001b[7D\u001b[K\n`alpha_delta_ratio`. Additionally, the test accuracy clean and perturbed ha\u001b[2D\u001b[K\nhave been improving steadily over time.\n\nBy reducing the `delta_init` value by 0.02, we aim to further stabilize the\u001b[3D\u001b[K\nthe model while maintaining the current trend of improving test accuracy. T\u001b[1D\u001b[K\nThis change is likely to improve the canonical score and preserve score det\u001b[3D\u001b[K\ndeterminism.\n\nNote that this recommendation does not consider other factors that may affe\u001b[4D\u001b[K\naffect the actual best next change, as these are not included in the provid\u001b[6D\u001b[K\nprovided prompt.", "ollama_model_used": "llama3:latest", "llm_context_snapshot": {"current_score": 0.771456, "target_score": 0.92, "epsilon": 0.0005, "plateau_limit": 3, "asset_kind": "prompt", "model": "llama3:latest"}, "summary_text": "asset=prompt change=prompt_text: length 482 -> 482 decision=reverted score=0.771456 V=0.790576 S=0.153719 clean=0.787986 energy=0.26686 model=llama3:latest"}
{"round": 0, "timestamp": "2026-06-29T12:28:56.342598+00:00", "asset": "python\\configs\\omega_experiment_01.yaml", "asset_kind": "config", "change_description": "config.delta_init: 0.7 -> 0.665", "baseline_score_before": 0.915675, "new_score": 0.908849, "decision": "reverted", "score_delta": -0.006826, "submetrics": {"test_acc_clean": 0.90595, "test_acc_perturbed": 0.873161, "inference_latency_ms": 45.345, "energy_rel_v4": 0.18193, "alpha": 1.293183, "delta": 0.711094, "alpha_delta_ratio": 1.818583, "eta_tern": 1.0, "zeta_Z3": 1.0, "V": 0.870315, "N": 0.926771, "S": 0.073229, "Df": 9.017101, "GS": 127.031469, "RT": 2.61803, "goldenscore": 0.936158, "spec_quality": 0.831833, "prompt_quality": 0.921875}, "report_path": "python\\runs\\auto_research\\20260629T122856338856Z\\report.json", "baseline_report_path": "python\\runs\\auto_research\\20260629T122327931245Z\\report.json", "ollama_suggestion": {"raw_response": "", "model_used": "qwen2.5-coder-3b-cpu:latest", "_parse_error": "Expecting value: line 1 column 1 (char 0)", "models_seen": ["qwen2.5-coder-7b-cpu:latest", "qwen2.5-coder-3b-cpu:latest", "llama3-8b-cpu:latest", "mmss-qwen3.5-0.8b:latest", "mmss-qwen2.5-0.5b:latest", "mmss-gemma4-mmss-json:latest", "mmss-gemma4-q4-creative:latest", "mmss-gemma4-q4:latest", "embeddinggemma:300m"], "requested_models": ["qwen2.5-coder-3b-cpu:latest"], "prompt_path": "D:\\project\\llm\\prompts\\work\\log_analysis.md"}, "ollama_suggestion_raw": "", "ollama_model_used": "qwen2.5-coder-3b-cpu:latest", "llm_context_snapshot": {"current_score": 0.915675, "target_score": 0.92, "epsilon": 0.0005, "plateau_limit": 3, "asset_kind": "config", "model": "qwen2.5-coder-3b-cpu:latest"}, "summary_text": "asset=config change=config.delta_init: 0.7 -> 0.665 decision=reverted score=0.908849 V=0.870315 S=0.073229 clean=0.90595 energy=0.18193 model=qwen2.5-coder-3b-cpu:latest"}
{"round": 1, "timestamp": "2026-06-29T12:33:58.759772+00:00", "asset": "D:\\project\\mmss_specs\\MMSSUNIVERSALMETALAYERv1.0.json", "asset_kind": "mmss_spec", "change_description": "unifiedmetrics.RT: 2.61803 -> 2.61803", "baseline_score_before": 0.915675, "new_score": 0.914219, "decision": "reverted", "score_delta": -0.001456, "submetrics": {"test_acc_clean": 0.910499, "test_acc_perturbed": 0.87771, "inference_latency_ms": 45.345, "energy_rel_v4": 0.173716, "alpha": 1.28982, "delta": 0.746094, "alpha_delta_ratio": 1.728764, "eta_tern": 1.0, "zeta_Z3": 1.0, "V": 0.862136, "N": 0.928818, "S": 0.071181, "Df": 9.019101, "GS": 126.213649, "RT": 2.61803, "goldenscore": 0.93507, "spec_quality": 0.7982, "prompt_quality": 0.921875}, "report_path": "python\\runs\\auto_research\\20260629T123358756008Z\\report.json", "baseline_report_path": "python\\runs\\auto_research\\20260629T122327931245Z\\report.json", "ollama_suggestion": {"raw_response": "", "model_used": "qwen2.5-coder-3b-cpu:latest", "_parse_error": "Expecting value: line 1 column 1 (char 0)", "models_seen": ["qwen2.5-coder-7b-cpu:latest", "qwen2.5-coder-3b-cpu:latest", "llama3-8b-cpu:latest", "mmss-qwen3.5-0.8b:latest", "mmss-qwen2.5-0.5b:latest", "mmss-gemma4-mmss-json:latest", "mmss-gemma4-q4-creative:latest", "mmss-gemma4-q4:latest", "embeddinggemma:300m"], "requested_models": ["qwen2.5-coder-3b-cpu:latest"], "prompt_path": "D:\\project\\llm\\prompts\\work\\log_analysis.md"}, "ollama_suggestion_raw": "", "ollama_model_used": "qwen2.5-coder-3b-cpu:latest", "llm_context_snapshot": {"current_score": 0.915675, "target_score": 0.92, "epsilon": 0.0005, "plateau_limit": 3, "asset_kind": "mmss_spec", "model": "qwen2.5-coder-3b-cpu:latest"}, "summary_text": "asset=mmss_spec change=unifiedmetrics.RT: 2.61803 -> 2.61803 decision=reverted score=0.914219 V=0.862136 S=0.071181 clean=0.910499 energy=0.173716 model=qwen2.5-coder-3b-cpu:latest"}
