{"round": 1, "timestamp": "2026-06-29T11:00:50.527298+00:00", "asset": "D:\\project\\mmss_specs\\MMSSPHYSIC20FORMALIZEDv2.json", "asset_kind": "mmss_spec", "change_description": "unifiedmetrics.RT: 2.61803 -> 2.61803", "baseline_score_before": 0.770627, "new_score": 0.76911, "decision": "reverted", "score_delta": -0.001517, "submetrics": {"test_acc_clean": 0.7865, "test_acc_perturbed": 0.751921, "inference_latency_ms": 50.33, "energy_rel_v4": 0.270932, "alpha": 1.11964, "delta": 0.623563, "alpha_delta_ratio": 1.795554, "eta_tern": 0.97764, "zeta_Z3": 0.840458, "V": 0.778274, "N": 0.843488, "S": 0.156512, "Df": 9.025882, "GS": 114.875257, "RT": 2.61803, "goldenscore": 0.83651, "spec_quality": 0.7964, "prompt_quality": 0.87125}, "report_path": "python\\runs\\auto_research\\20260629T110050522373Z\\report.json", "baseline_report_path": "python\\runs\\auto_research\\20260629T104022556585Z\\report.json", "ollama_suggestion": {"raw_response": "To analyze this log, we need to focus on the submetrics and their trends ov\u001b[2D\u001b[K\nover time. From the data, we can see that the test accuracy clean and pertu\u001b[5D\u001b[K\nperturbed have been improving steadily over time. This suggests that the cu\u001b[2D\u001b[K\ncurrent configuration is trending towards better performance.\n\nLet's examine some specific metrics:\n\n* `test_acc_clean`: 0.940344 -> 0.943002 (improvement)\n* `inference_latency_ms`: 46.5 -> 50.33 (decrease)\n\nThese improvements in test accuracy and inference latency suggest that the \u001b[K\ncurrent configuration is on a good path.\n\nNow, let's examine some other submetrics:\n\n* `energy_rel_v4`: This metric has been steadily decreasing, which indicate\u001b[8D\u001b[K\nindicates a reduction in energy consumption.\n* `alpha`, `delta`, and `alpha_delta_ratio` have all decreased, suggesting \u001b[K\nthat the model is becoming more stable.\n\nGiven these trends, I recommend the smallest useful next change to be:\n\n```\n{\n  \"asset\": \"config\",\n  \"field\": \"delta_init\",\n  \"direction\": \"-0.02\",\n  \"magnitude\": 0.58,\n  \"reason\": \"Further stabilization of the model\"\n}\n```\n\nThis change aims to further stabilize the model by reducing the `delta_init\u001b[11D\u001b[K\n`delta_init` value. This should help to maintain the current trend of impro\u001b[5D\u001b[K\nimproving test accuracy and reduce inference latency.\n\nNote that this recommendation is based on a thorough analysis of the log da\u001b[2D\u001b[K\ndata and submetrics. The actual best next change may depend on other factor\u001b[6D\u001b[K\nfactors not considered in this prompt.", "model_used": "llama3:latest", "_parse_error": "Expecting value: line 1 column 1 (char 0)", "models_seen": ["qwen25-base:latest", "qwen35-mmss:latest", "llama3:latest", "qwen-coder-3b-cpu:latest", "qwen-coder-7b-cpu:latest", "qwen2.5-coder:7b", "qwen2.5-coder:3b", "mmss-gemma4-mmss-json:latest", "mmss-gemma4-q4-creative:latest", "mmss-gemma4-q4:latest", "embeddinggemma:300m"], "requested_models": ["llama3:latest"], "prompt_path": "D:\\project\\llm\\prompts\\work\\log_analysis.md"}, "ollama_suggestion_raw": "To analyze this log, we need to focus on the submetrics and their trends ov\u001b[2D\u001b[K\nover time. From the data, we can see that the test accuracy clean and pertu\u001b[5D\u001b[K\nperturbed have been improving steadily over time. This suggests that the cu\u001b[2D\u001b[K\ncurrent configuration is trending towards better performance.\n\nLet's examine some specific metrics:\n\n* `test_acc_clean`: 0.940344 -> 0.943002 (improvement)\n* `inference_latency_ms`: 46.5 -> 50.33 (decrease)\n\nThese improvements in test accuracy and inference latency suggest that the \u001b[K\ncurrent configuration is on a good path.\n\nNow, let's examine some other submetrics:\n\n* `energy_rel_v4`: This metric has been steadily decreasing, which indicate\u001b[8D\u001b[K\nindicates a reduction in energy consumption.\n* `alpha`, `delta`, and `alpha_delta_ratio` have all decreased, suggesting \u001b[K\nthat the model is becoming more stable.\n\nGiven these trends, I recommend the smallest useful next change to be:\n\n```\n{\n  \"asset\": \"config\",\n  \"field\": \"delta_init\",\n  \"direction\": \"-0.02\",\n  \"magnitude\": 0.58,\n  \"reason\": \"Further stabilization of the model\"\n}\n```\n\nThis change aims to further stabilize the model by reducing the `delta_init\u001b[11D\u001b[K\n`delta_init` value. This should help to maintain the current trend of impro\u001b[5D\u001b[K\nimproving test accuracy and reduce inference latency.\n\nNote that this recommendation is based on a thorough analysis of the log da\u001b[2D\u001b[K\ndata and submetrics. The actual best next change may depend on other factor\u001b[6D\u001b[K\nfactors not considered in this prompt.", "ollama_model_used": "llama3:latest", "llm_context_snapshot": {"current_score": 0.770627, "target_score": 0.92, "epsilon": 0.0005, "plateau_limit": 3, "asset_kind": "mmss_spec", "model": "llama3:latest"}, "summary_text": "asset=mmss_spec change=unifiedmetrics.RT: 2.61803 -> 2.61803 decision=reverted score=0.769110 V=0.778274 S=0.156512 clean=0.7865 energy=0.270932 model=llama3:latest"}
{"round": 2, "timestamp": "2026-06-29T11:09:09.871497+00:00", "asset": "D:\\project\\llm\\prompts\\work\\log_analysis.md", "asset_kind": "prompt", "change_description": "prompt_text: length 414 -> 482", "baseline_score_before": 0.770627, "new_score": 0.771456, "decision": "kept", "score_delta": 0.000829, "submetrics": {"test_acc_clean": 0.787986, "test_acc_perturbed": 0.753407, "inference_latency_ms": 50.33, "energy_rel_v4": 0.26686, "alpha": 1.123033, "delta": 0.625687, "alpha_delta_ratio": 1.794879, "eta_tern": 0.981033, "zeta_Z3": 0.844708, "V": 0.790576, "N": 0.846281, "S": 0.153719, "Df": 9.023541, "GS": 116.254007, "RT": 2.61803, "goldenscore": 0.842175, "spec_quality": 0.830333, "prompt_quality": 0.91375}, "report_path": "python\\runs\\auto_research\\20260629T110909860382Z\\report.json", "baseline_report_path": "python\\runs\\auto_research\\20260629T110909860382Z\\report.json", "ollama_suggestion": {"raw_response": "To analyze this log, I will focus on the submetrics and their trends over t\u001b[1D\u001b[K\ntime. From the data, we can see that the test accuracy clean and perturbed \u001b[K\nhave been improving steadily over time. This suggests that the current conf\u001b[4D\u001b[K\nconfiguration is trending towards better performance.\n\nLet's examine some specific metrics:\n\n* `test_acc_clean`: 0.940344 -> 0.943002 (improvement)\n* `inference_latency_ms`: 46.5 -> 50.33 (decrease)\n\nThese improvements in test accuracy and inference latency suggest that the \u001b[K\ncurrent configuration is on a good path.\n\nNow, let's examine some other submetrics:\n\n* `energy_rel_v4`: This metric has been steadily decreasing, which indicate\u001b[8D\u001b[K\nindicates a reduction in energy consumption.\n* `alpha`, `delta`, and `alpha_delta_ratio` have all decreased, suggesting \u001b[K\nthat the model is becoming more stable.\n\nGiven these trends, I recommend the smallest useful next change to be:\n\n```\n{\n  \"asset\": \"config\",\n  \"field\": \"delta_init\",\n  \"direction\": \"-0.02\",\n  \"magnitude\": 0.58,\n  \"reason\": \"Further stabilization of the model\"\n}\n```\n\nThis change aims to further stabilize the model by reducing the `delta_init\u001b[11D\u001b[K\n`delta_init` value. This should help to maintain the current trend of impro\u001b[5D\u001b[K\nimproving test accuracy and reduce inference latency.\n\nNote that this recommendation is based on a thorough analysis of the log da\u001b[2D\u001b[K\ndata and submetrics. The actual best next change may depend on other factor\u001b[6D\u001b[K\nfactors not considered in this prompt.", "model_used": "llama3:latest", "_parse_error": "Expecting value: line 1 column 1 (char 0)", "models_seen": ["qwen25-base:latest", "qwen35-mmss:latest", "llama3:latest", "qwen-coder-3b-cpu:latest", "qwen-coder-7b-cpu:latest", "qwen2.5-coder:7b", "qwen2.5-coder:3b", "mmss-gemma4-mmss-json:latest", "mmss-gemma4-q4-creative:latest", "mmss-gemma4-q4:latest", "embeddinggemma:300m"], "requested_models": ["llama3:latest"], "prompt_path": "D:\\project\\llm\\prompts\\work\\log_analysis.md"}, "ollama_suggestion_raw": "To analyze this log, I will focus on the submetrics and their trends over t\u001b[1D\u001b[K\ntime. From the data, we can see that the test accuracy clean and perturbed \u001b[K\nhave been improving steadily over time. This suggests that the current conf\u001b[4D\u001b[K\nconfiguration is trending towards better performance.\n\nLet's examine some specific metrics:\n\n* `test_acc_clean`: 0.940344 -> 0.943002 (improvement)\n* `inference_latency_ms`: 46.5 -> 50.33 (decrease)\n\nThese improvements in test accuracy and inference latency suggest that the \u001b[K\ncurrent configuration is on a good path.\n\nNow, let's examine some other submetrics:\n\n* `energy_rel_v4`: This metric has been steadily decreasing, which indicate\u001b[8D\u001b[K\nindicates a reduction in energy consumption.\n* `alpha`, `delta`, and `alpha_delta_ratio` have all decreased, suggesting \u001b[K\nthat the model is becoming more stable.\n\nGiven these trends, I recommend the smallest useful next change to be:\n\n```\n{\n  \"asset\": \"config\",\n  \"field\": \"delta_init\",\n  \"direction\": \"-0.02\",\n  \"magnitude\": 0.58,\n  \"reason\": \"Further stabilization of the model\"\n}\n```\n\nThis change aims to further stabilize the model by reducing the `delta_init\u001b[11D\u001b[K\n`delta_init` value. This should help to maintain the current trend of impro\u001b[5D\u001b[K\nimproving test accuracy and reduce inference latency.\n\nNote that this recommendation is based on a thorough analysis of the log da\u001b[2D\u001b[K\ndata and submetrics. The actual best next change may depend on other factor\u001b[6D\u001b[K\nfactors not considered in this prompt.", "ollama_model_used": "llama3:latest", "llm_context_snapshot": {"current_score": 0.771456, "target_score": 0.92, "epsilon": 0.0005, "plateau_limit": 3, "asset_kind": "prompt", "model": "llama3:latest"}, "summary_text": "asset=prompt change=prompt_text: length 414 -> 482 decision=kept score=0.771456 V=0.790576 S=0.153719 clean=0.787986 energy=0.26686 model=llama3:latest"}
{"round": 3, "timestamp": "2026-06-29T11:15:56.735984+00:00", "asset": "python\\configs\\omega_loop_test.yaml", "asset_kind": "config", "change_description": "config.beta: 0.18 -> 0.1746", "baseline_score_before": 0.771456, "new_score": 0.771268, "decision": "reverted", "score_delta": -0.000188, "submetrics": {"test_acc_clean": 0.787805, "test_acc_perturbed": 0.753227, "inference_latency_ms": 50.33, "energy_rel_v4": 0.26686, "alpha": 1.117633, "delta": 0.625687, "alpha_delta_ratio": 1.786248, "eta_tern": 0.981033, "zeta_Z3": 0.844708, "V": 0.790455, "N": 0.8462, "S": 0.1538, "Df": 9.02355, "GS": 116.241972, "RT": 2.61803, "goldenscore": 0.842084, "spec_quality": 0.830333, "prompt_quality": 0.91375}, "report_path": "python\\runs\\auto_research\\20260629T111556725747Z\\report.json", "baseline_report_path": "python\\runs\\auto_research\\20260629T110909860382Z\\report.json", "ollama_suggestion": {"raw_response": "Based on the provided log analysis, I would recommend the following smalles\u001b[7D\u001b[K\nsmallest useful next change:\n\n```\n{\n  \"asset\": \"config\",\n  \"field\": \"delta_init\",\n  \"direction\": \"-0.02\",\n  \"magnitude\": 0.58,\n  \"reason\": \"Further stabilization of the model\"\n}\n```\n\nThis recommendation is based on a thorough analysis of the log data and sub\u001b[3D\u001b[K\nsubmetrics. The current trend suggests that the model is becoming more stab\u001b[4D\u001b[K\nstable, as indicated by decreasing values for `alpha`, `delta`, and `alpha_\u001b[7D\u001b[K\n`alpha_delta_ratio`. Additionally, the test accuracy clean and perturbed ha\u001b[2D\u001b[K\nhave been improving steadily over time.\n\nBy reducing the `delta_init` value by 0.02, we aim to further stabilize the\u001b[3D\u001b[K\nthe model while maintaining the current trend of improving test accuracy. T\u001b[1D\u001b[K\nThis change is likely to improve the canonical score and preserve score det\u001b[3D\u001b[K\ndeterminism.\n\nNote that this recommendation does not consider other factors that may affe\u001b[4D\u001b[K\naffect the actual best next change, as these are not included in the provid\u001b[6D\u001b[K\nprovided prompt.", "model_used": "llama3:latest", "_parse_error": "Expecting value: line 1 column 1 (char 0)", "models_seen": ["qwen25-base:latest", "qwen35-mmss:latest", "llama3:latest", "qwen-coder-3b-cpu:latest", "qwen-coder-7b-cpu:latest", "qwen2.5-coder:7b", "qwen2.5-coder:3b", "mmss-gemma4-mmss-json:latest", "mmss-gemma4-q4-creative:latest", "mmss-gemma4-q4:latest", "embeddinggemma:300m"], "requested_models": ["llama3:latest"], "prompt_path": "D:\\project\\llm\\prompts\\work\\log_analysis.md"}, "ollama_suggestion_raw": "Based on the provided log analysis, I would recommend the following smalles\u001b[7D\u001b[K\nsmallest useful next change:\n\n```\n{\n  \"asset\": \"config\",\n  \"field\": \"delta_init\",\n  \"direction\": \"-0.02\",\n  \"magnitude\": 0.58,\n  \"reason\": \"Further stabilization of the model\"\n}\n```\n\nThis recommendation is based on a thorough analysis of the log data and sub\u001b[3D\u001b[K\nsubmetrics. The current trend suggests that the model is becoming more stab\u001b[4D\u001b[K\nstable, as indicated by decreasing values for `alpha`, `delta`, and `alpha_\u001b[7D\u001b[K\n`alpha_delta_ratio`. Additionally, the test accuracy clean and perturbed ha\u001b[2D\u001b[K\nhave been improving steadily over time.\n\nBy reducing the `delta_init` value by 0.02, we aim to further stabilize the\u001b[3D\u001b[K\nthe model while maintaining the current trend of improving test accuracy. T\u001b[1D\u001b[K\nThis change is likely to improve the canonical score and preserve score det\u001b[3D\u001b[K\ndeterminism.\n\nNote that this recommendation does not consider other factors that may affe\u001b[4D\u001b[K\naffect the actual best next change, as these are not included in the provid\u001b[6D\u001b[K\nprovided prompt.", "ollama_model_used": "llama3:latest", "llm_context_snapshot": {"current_score": 0.771456, "target_score": 0.92, "epsilon": 0.0005, "plateau_limit": 3, "asset_kind": "config", "model": "llama3:latest"}, "summary_text": "asset=config change=config.beta: 0.18 -> 0.1746 decision=reverted score=0.771268 V=0.790455 S=0.1538 clean=0.787805 energy=0.26686 model=llama3:latest"}
{"round": 4, "timestamp": "2026-06-29T11:23:01.879031+00:00", "asset": "D:\\project\\mmss_specs\\MMSSPHYSIC20FORMALIZEDv2.json", "asset_kind": "mmss_spec", "change_description": "unifiedmetrics.N: 0.985 -> 0.985", "baseline_score_before": 0.771456, "new_score": 0.770073, "decision": "reverted", "score_delta": -0.001383, "submetrics": {"test_acc_clean": 0.787213, "test_acc_perturbed": 0.752634, "inference_latency_ms": 50.33, "energy_rel_v4": 0.270572, "alpha": 1.11994, "delta": 0.625687, "alpha_delta_ratio": 1.789935, "eta_tern": 0.97794, "zeta_Z3": 0.844708, "V": 0.779749, "N": 0.845933, "S": 0.154067, "Df": 9.025644, "GS": 115.094007, "RT": 2.61803, "goldenscore": 0.838076, "spec_quality": 0.7994, "prompt_quality": 0.91375}, "report_path": "python\\runs\\auto_research\\20260629T112301869663Z\\report.json", "baseline_report_path": "python\\runs\\auto_research\\20260629T110909860382Z\\report.json", "ollama_suggestion": {"raw_response": "Based on the provided log analysis, I would recommend the following smalles\u001b[7D\u001b[K\nsmallest useful next change:\n\n```\n{\n  \"asset\": \"config\",\n  \"field\": \"delta_init\",\n  \"direction\": \"-0.02\",\n  \"magnitude\": 0.58,\n  \"reason\": \"Further stabilization of the model\"\n}\n```\n\nThis recommendation is based on a thorough analysis of the log data and sub\u001b[3D\u001b[K\nsubmetrics. The current trend suggests that the model is becoming more stab\u001b[4D\u001b[K\nstable, as indicated by decreasing values for `alpha`, `delta`, and `alpha_\u001b[7D\u001b[K\n`alpha_delta_ratio`. Additionally, the test accuracy clean and perturbed ha\u001b[2D\u001b[K\nhave been improving steadily over time.\n\nBy reducing the `delta_init` value by 0.02, we aim to further stabilize the\u001b[3D\u001b[K\nthe model while maintaining the current trend of improving test accuracy. T\u001b[1D\u001b[K\nThis change is likely to improve the canonical score and preserve score det\u001b[3D\u001b[K\ndeterminism.\n\nNote that this recommendation does not consider other factors that may affe\u001b[4D\u001b[K\naffect the actual best next change, as these are not included in the provid\u001b[6D\u001b[K\nprovided prompt.", "model_used": "llama3:latest", "_parse_error": "Expecting value: line 1 column 1 (char 0)", "models_seen": ["qwen25-base:latest", "qwen35-mmss:latest", "llama3:latest", "qwen-coder-3b-cpu:latest", "qwen-coder-7b-cpu:latest", "qwen2.5-coder:7b", "qwen2.5-coder:3b", "mmss-gemma4-mmss-json:latest", "mmss-gemma4-q4-creative:latest", "mmss-gemma4-q4:latest", "embeddinggemma:300m"], "requested_models": ["llama3:latest"], "prompt_path": "D:\\project\\llm\\prompts\\work\\log_analysis.md"}, "ollama_suggestion_raw": "Based on the provided log analysis, I would recommend the following smalles\u001b[7D\u001b[K\nsmallest useful next change:\n\n```\n{\n  \"asset\": \"config\",\n  \"field\": \"delta_init\",\n  \"direction\": \"-0.02\",\n  \"magnitude\": 0.58,\n  \"reason\": \"Further stabilization of the model\"\n}\n```\n\nThis recommendation is based on a thorough analysis of the log data and sub\u001b[3D\u001b[K\nsubmetrics. The current trend suggests that the model is becoming more stab\u001b[4D\u001b[K\nstable, as indicated by decreasing values for `alpha`, `delta`, and `alpha_\u001b[7D\u001b[K\n`alpha_delta_ratio`. Additionally, the test accuracy clean and perturbed ha\u001b[2D\u001b[K\nhave been improving steadily over time.\n\nBy reducing the `delta_init` value by 0.02, we aim to further stabilize the\u001b[3D\u001b[K\nthe model while maintaining the current trend of improving test accuracy. T\u001b[1D\u001b[K\nThis change is likely to improve the canonical score and preserve score det\u001b[3D\u001b[K\ndeterminism.\n\nNote that this recommendation does not consider other factors that may affe\u001b[4D\u001b[K\naffect the actual best next change, as these are not included in the provid\u001b[6D\u001b[K\nprovided prompt.", "ollama_model_used": "llama3:latest", "llm_context_snapshot": {"current_score": 0.771456, "target_score": 0.92, "epsilon": 0.0005, "plateau_limit": 3, "asset_kind": "mmss_spec", "model": "llama3:latest"}, "summary_text": "asset=mmss_spec change=unifiedmetrics.N: 0.985 -> 0.985 decision=reverted score=0.770073 V=0.779749 S=0.154067 clean=0.787213 energy=0.270572 model=llama3:latest"}
